{"$schema":"https://json-schema.org/draft/2020-12/schema","additionalProperties":false,"properties":{"aggregate":{"additionalProperties":false,"patternProperties":{"^(A2|A3|A4)$":{"additionalProperties":false,"properties":{"action_applicable_rate":{"oneOf":[{"maximum":1,"minimum":0,"type":"number"},{"type":"null"}]},"applicable_action_count":{"minimum":0,"type":"integer"},"attempted_action_count":{"minimum":0,"type":"integer"},"end_only_rate":{"maximum":1,"minimum":0,"type":"number"},"max_success_rate":{"maximum":1,"minimum":0,"type":"number"},"mean_executability":{"maximum":1,"minimum":0,"type":"number"},"mean_plan_length_difference":{"minimum":0,"type":"number"},"mean_success_rate":{"maximum":1,"minimum":0,"type":"number"},"min_success_rate":{"maximum":1,"minimum":0,"type":"number"},"nonempty_plan_rate":{"maximum":1,"minimum":0,"type":"number"},"structural_breakdown":{"additionalProperties":false,"properties":{"1-2":{"additionalProperties":false,"properties":{"evaluation_unit_count":{"minimum":0,"type":"integer"},"failure_code_distribution":{"additionalProperties":{"minimum":0,"type":"integer"},"type":"object"},"fully_executable_plan_rate":{"maximum":1,"minimum":0,"type":"number"},"mean_predicted_plan_length":{"minimum":0,"type":"number"},"seed_count":{"minimum":0,"type":"integer"},"task_success_rate":{"maximum":1,"minimum":0,"type":"number"},"unique_task_count":{"minimum":0,"type":"integer"}},"required":["unique_task_count","seed_count","evaluation_unit_count","task_success_rate","fully_executable_plan_rate","mean_predicted_plan_length","failure_code_distribution"],"type":"object"},"3-4":{"additionalProperties":false,"properties":{"evaluation_unit_count":{"minimum":0,"type":"integer"},"failure_code_distribution":{"additionalProperties":{"minimum":0,"type":"integer"},"type":"object"},"fully_executable_plan_rate":{"maximum":1,"minimum":0,"type":"number"},"mean_predicted_plan_length":{"minimum":0,"type":"number"},"seed_count":{"minimum":0,"type":"integer"},"task_success_rate":{"maximum":1,"minimum":0,"type":"number"},"unique_task_count":{"minimum":0,"type":"integer"}},"required":["unique_task_count","seed_count","evaluation_unit_count","task_success_rate","fully_executable_plan_rate","mean_predicted_plan_length","failure_code_distribution"],"type":"object"},"5+":{"additionalProperties":false,"properties":{"evaluation_unit_count":{"minimum":0,"type":"integer"},"failure_code_distribution":{"additionalProperties":{"minimum":0,"type":"integer"},"type":"object"},"fully_executable_plan_rate":{"maximum":1,"minimum":0,"type":"number"},"mean_predicted_plan_length":{"minimum":0,"type":"number"},"seed_count":{"minimum":0,"type":"integer"},"task_success_rate":{"maximum":1,"minimum":0,"type":"number"},"unique_task_count":{"minimum":0,"type":"integer"}},"required":["unique_task_count","seed_count","evaluation_unit_count","task_success_rate","fully_executable_plan_rate","mean_predicted_plan_length","failure_code_distribution"],"type":"object"}},"type":"object"},"success_counts":{"additionalProperties":false,"patternProperties":{"^(17|29|43)$":{"minimum":0,"type":"integer"}},"type":"object"}},"required":["mean_success_rate","min_success_rate","max_success_rate","success_counts","mean_executability","attempted_action_count","applicable_action_count","action_applicable_rate","nonempty_plan_rate","end_only_rate","mean_plan_length_difference","structural_breakdown"],"type":"object"}},"type":"object"},"canonical_numeric_policy":{"additionalProperties":false,"properties":{"absolute_zero_cell_bound":{"const":3.587324068671532e-43},"cleared_mantissa_bits":{"const":8},"encoding":{"const":"ieee754-float32-little-endian"},"quantization":{"const":"clear-8-least-significant-mantissa-bits"},"relative_cell_bound":{"const":3.0517578125e-05},"torch_object_encoding_version":{"const":"toy-quality-torch-object-encoding/2.0"},"version":{"const":"toy-quality-numeric-identity/1.0"}},"required":["version","encoding","quantization","cleared_mantissa_bits","relative_cell_bound","absolute_zero_cell_bound","torch_object_encoding_version"],"type":"object"},"dataset_hash":{"pattern":"^sha256:[0-9a-f]{64}$","type":"string"},"evaluator_source_files":{"items":{"additionalProperties":false,"properties":{"path":{"pattern":"^[A-Za-z0-9_./-]+$","type":"string"},"sha256":{"pattern":"^sha256:[0-9a-f]{64}$","type":"string"}},"required":["path","sha256"],"type":"object"},"minItems":1,"type":"array","uniqueItems":true},"evaluator_source_sha256":{"pattern":"^sha256:[0-9a-f]{64}$","type":"string"},"evaluator_version":{"const":"development-quality-evaluation/0.1"},"heldout_task_count":{"const":2},"implementation_commit":{"pattern":"^[0-9a-f]{40}$","type":"string"},"observed_failure_codes":{"items":{"enum":["PLAN_NO_END","PLAN_PARSE_ERROR","PLAN_UNKNOWN_REF","PLAN_GENERATION_ERROR","EXECUTOR_PRECONDITION_FAILED","GOAL_NOT_ACHIEVED","LATENT_NONFINITE","LATENT_ZERO_NORM","LATENT_DIMENSION"]},"type":"array","uniqueItems":true},"observed_feedback_application_positions":{"minimum":0,"type":"integer"},"observed_nonzero_downstream_semantic_component_positions":{"minimum":0,"type":"integer"},"observed_nonzero_feedback_application_positions":{"minimum":0,"type":"integer"},"paired_comparisons":{"items":{"additionalProperties":false,"properties":{"both_fail":{"minimum":0,"type":"integer"},"both_succeed":{"minimum":0,"type":"integer"},"first":{"enum":["A2","A3","A4"]},"only_first_succeeds":{"minimum":0,"type":"integer"},"only_second_succeeds":{"minimum":0,"type":"integer"},"pair_count":{"minimum":0,"type":"integer"},"second":{"enum":["A2","A3","A4"]}},"required":["first","second","pair_count","both_succeed","only_first_succeeds","only_second_succeeds","both_fail"],"type":"object"},"maxItems":3,"minItems":3,"type":"array"},"per_seed":{"additionalProperties":false,"patternProperties":{"^(A2|A3|A4)/seed-(17|29|43)$":{"additionalProperties":false,"properties":{"action_applicable_rate":{"oneOf":[{"maximum":1,"minimum":0,"type":"number"},{"type":"null"}]},"action_parse_valid_rate":{"maximum":1,"minimum":0,"type":"number"},"applicable_action_count":{"minimum":0,"type":"integer"},"attempted_action_count":{"minimum":0,"type":"integer"},"end_only_rate":{"maximum":1,"minimum":0,"type":"number"},"end_rate":{"maximum":1,"minimum":0,"type":"number"},"evaluation_unit_count":{"minimum":0,"type":"integer"},"exact_plan_match_rate":{"maximum":1,"minimum":0,"type":"number"},"execution_completed_rate":{"maximum":1,"minimum":0,"type":"number"},"failure_code_distribution":{"additionalProperties":{"minimum":0,"type":"integer"},"type":"object"},"fully_executable_plan_rate":{"maximum":1,"minimum":0,"type":"number"},"heldout_task_count":{"minimum":0,"type":"integer"},"mean_absolute_plan_length_difference":{"minimum":0,"type":"number"},"mean_gold_plan_length":{"minimum":0,"type":"number"},"mean_predicted_plan_length":{"minimum":0,"type":"number"},"median_predicted_plan_length":{"minimum":0,"type":"number"},"nonempty_plan_rate":{"maximum":1,"minimum":0,"type":"number"},"plan_generation_success_rate":{"maximum":1,"minimum":0,"type":"number"},"seed_count":{"minimum":0,"type":"integer"},"success_count":{"minimum":0,"type":"integer"},"task_success_rate":{"maximum":1,"minimum":0,"type":"number"},"unique_task_count":{"minimum":0,"type":"integer"}},"required":["unique_task_count","seed_count","evaluation_unit_count","heldout_task_count","success_count","task_success_rate","plan_generation_success_rate","end_rate","fully_executable_plan_rate","action_parse_valid_rate","attempted_action_count","applicable_action_count","action_applicable_rate","nonempty_plan_rate","end_only_rate","execution_completed_rate","exact_plan_match_rate","mean_predicted_plan_length","median_predicted_plan_length","mean_gold_plan_length","mean_absolute_plan_length_difference","failure_code_distribution"],"type":"object"}},"type":"object"},"replay_hash":{"pattern":"^sha256:[0-9a-f]{64}$","type":"string"},"requirements_lock_sha256":{"pattern":"^sha256:[0-9a-f]{64}$","type":"string"},"runtime_versions":{"additionalProperties":false,"properties":{"cuda_available":{"type":"boolean"},"cuda_version":{"type":["string","null"]},"execution_device":{"const":"cpu"},"numpy":{"type":"string"},"python":{"type":"string"},"torch":{"type":"string"}},"required":["python","torch","numpy","cuda_version","cuda_available","execution_device"],"type":"object"},"seeds":{"const":[17,29,43]},"status":{"const":"development-only-diagnostic"},"train_task_count":{"const":3},"training_budget":{"additionalProperties":false,"properties":{"checkpoint_policy":{"const":"final_epoch_only_no_heldout_selection"},"epochs":{"const":3},"updates_per_run":{"const":9}},"required":["epochs","updates_per_run","checkpoint_policy"],"type":"object"}},"required":["status","evaluator_version","dataset_hash","seeds","training_budget","per_seed","aggregate","paired_comparisons","observed_failure_codes","replay_hash","evaluator_source_files","evaluator_source_sha256","train_task_count","heldout_task_count","implementation_commit","requirements_lock_sha256","runtime_versions","observed_feedback_application_positions","observed_nonzero_feedback_application_positions","observed_nonzero_downstream_semantic_component_positions","canonical_numeric_policy"],"type":"object"}
