{"aggregate":{"A2":{"action_applicable_rate":null,"applicable_action_count":0,"attempted_action_count":0,"end_only_rate":1.0,"max_success_rate":0.0,"mean_executability":0.0,"mean_plan_length_difference":6,"mean_success_rate":0.0,"min_success_rate":0.0,"nonempty_plan_rate":0.0,"structural_breakdown":{"5+":{"evaluation_unit_count":6,"failure_code_distribution":{"GOAL_NOT_ACHIEVED":6},"fully_executable_plan_rate":0.0,"mean_predicted_plan_length":0,"seed_count":3,"task_success_rate":0.0,"unique_task_count":2}},"success_counts":{"17":0,"29":0,"43":0}},"A3":{"action_applicable_rate":null,"applicable_action_count":0,"attempted_action_count":0,"end_only_rate":1.0,"max_success_rate":0.0,"mean_executability":0.0,"mean_plan_length_difference":6,"mean_success_rate":0.0,"min_success_rate":0.0,"nonempty_plan_rate":0.0,"structural_breakdown":{"5+":{"evaluation_unit_count":6,"failure_code_distribution":{"GOAL_NOT_ACHIEVED":6},"fully_executable_plan_rate":0.0,"mean_predicted_plan_length":0,"seed_count":3,"task_success_rate":0.0,"unique_task_count":2}},"success_counts":{"17":0,"29":0,"43":0}},"A4":{"action_applicable_rate":null,"applicable_action_count":0,"attempted_action_count":0,"end_only_rate":1.0,"max_success_rate":0.0,"mean_executability":0.0,"mean_plan_length_difference":6,"mean_success_rate":0.0,"min_success_rate":0.0,"nonempty_plan_rate":0.0,"structural_breakdown":{"5+":{"evaluation_unit_count":6,"failure_code_distribution":{"GOAL_NOT_ACHIEVED":6},"fully_executable_plan_rate":0.0,"mean_predicted_plan_length":0,"seed_count":3,"task_success_rate":0.0,"unique_task_count":2}},"success_counts":{"17":0,"29":0,"43":0}}},"canonical_numeric_policy":{"absolute_zero_cell_bound":3.587324068671532e-43,"cleared_mantissa_bits":8,"encoding":"ieee754-float32-little-endian","quantization":"clear-8-least-significant-mantissa-bits","relative_cell_bound":3.0517578125e-05,"torch_object_encoding_version":"toy-quality-torch-object-encoding/2.0","version":"toy-quality-numeric-identity/1.0"},"dataset_hash":"sha256:60e4ce06d6cfc90dc467fb4e82b2eb71cf2d92d37471eee3aeda64f864c541df","evaluator_source_files":[{"path":"docs/architecture/planner_module_inventory_v1.yaml","sha256":"sha256:f111f69265d152b43a583536736c337f3b1c2a893c740b7c141a533b8bf55aef"},{"path":"docs/architecture/task_encoding_v1.yaml","sha256":"sha256:9e29b8ec07c6be71c5aaadbb93301bd1f608bd0890d035a5d0d6f3f4d6cb0e69"},{"path":"planner_toy/canonical.py","sha256":"sha256:f30915ff36024faba5e64809f02e764f938b3406f9088b30388443b7f738e6dc"},{"path":"planner_toy/canonical_runtime.py","sha256":"sha256:4d610cac81858d1d6dd7e18a64fbb89cc6f2d80c33e72dd10639fd9d91f0bf59"},{"path":"planner_toy/dataset.py","sha256":"sha256:07c528bcd6b1f395c0845b3edd6e0bbc02af5002ca97d9c88e4877a6f2969755"},{"path":"planner_toy/domain.py","sha256":"sha256:d4e80f77d8e648e2d3832cece07c74714814ae2cb25685f80133d19231fb1d69"},{"path":"planner_toy/e2e.py","sha256":"sha256:a472d2e62ad8d68e1e0317afd1d40bbd5b049af233b91b2b281d5c2ee8932a26"},{"path":"planner_toy/model.py","sha256":"sha256:63c5e874dc7bd2b11957458c886b8313c63f8c4901be8406079e287b1012fe57"},{"path":"planner_toy/numeric_identity.py","sha256":"sha256:9d7867f7def13fc76595a166b23d31365883116bb80ddb8b7a6ca6a6639a297e"},{"path":"planner_toy/quality.py","sha256":"sha256:d7a00853073c8357a31d6e6d438c353a55c6a16ad339e7108f3e2ef5d88a7bd4"},{"path":"planner_toy/schemas/toy_attempt_log.schema.json","sha256":"sha256:be6035f36e931a326e6ab79a20561ef0b99ae7f14c44954bcefbc374d1c91cf5"},{"path":"planner_toy/schemas/toy_checkpoint_manifest.schema.json","sha256":"sha256:7c7a1056eef646814a94151eee835cad98e43ab8fcaaafcb1d176e86303d280f"},{"path":"planner_toy/schemas/toy_development_config.schema.json","sha256":"sha256:ec90541caa31ead988dc56215c7d551c243f7b8cd4e5e178bbe4a09758263619"},{"path":"planner_toy/schemas/toy_episode_log.schema.json","sha256":"sha256:b44ee2f4869c01611c5e16b1da315861761a74dae2fe70320ac9965c005d4a7f"},{"path":"planner_toy/schemas/toy_episode_plan_manifest.schema.json","sha256":"sha256:179b6735c00fc040e35af96150f02d7a4b1e5e3955ea98998664d103ff7f876b"},{"path":"planner_toy/schemas/toy_evaluation_result.schema.json","sha256":"sha256:e75aea44d9651a6bc63dadf5f521b3360bc130671879310e6f1ab0dbe8d3324d"},{"path":"planner_toy/schemas/toy_optimizer_evidence.schema.json","sha256":"sha256:535a80b9d06608c8f88d946edba6987245440442587597d79771d3c6c85db767"},{"path":"planner_toy/schemas/toy_planner_request.schema.json","sha256":"sha256:151261409b04b6cbd61e933b86c88ca969eb6c6532ffff1a88685e3c197a0852"},{"path":"planner_toy/schemas/toy_quality_aggregate_summary.schema.json","sha256":"sha256:84d484ca630afa8973d70e9fb0b4dbc609fee21f16fa2875d3ad16dfe15f78a8"},{"path":"planner_toy/schemas/toy_quality_attempt_log.schema.json","sha256":"sha256:a49d944df6601f7364ef54d57638124dfce3d28ff24dcc925845ae0f44b6ee7f"},{"path":"planner_toy/schemas/toy_quality_checkpoint_manifest.schema.json","sha256":"sha256:8133f5ac39123542a93cb873480ad599fb8cd39937d44a9b26381badbfe0cd14"},{"path":"planner_toy/schemas/toy_quality_compact_summary.schema.json","sha256":"sha256:2c45726211a8908be394bdba8b7d06dd26b17bc6349ad5abd6e5555acce6d3da"},{"path":"planner_toy/schemas/toy_quality_dataset_manifest.schema.json","sha256":"sha256:1682491891d1b3a90f7a9050838797cc0910f81bc31efa7bf981c5a2f044a666"},{"path":"planner_toy/schemas/toy_quality_episode_log.schema.json","sha256":"sha256:be5c0d58c94b7d80cd579db3002f3bd6d5aafcf3d9623fb38651770af0b95e10"},{"path":"planner_toy/schemas/toy_quality_episode_plan_manifest.schema.json","sha256":"sha256:a66f800b05df57d7ec00a26267e1f50d342490401556c36883d502b3f3737dad"},{"path":"planner_toy/schemas/toy_quality_evaluation.schema.json","sha256":"sha256:11c544d6a318cffb89900f38ad3e14b5a48f673ad870f11c34901f1d696a2c7e"},{"path":"planner_toy/schemas/toy_quality_evaluation_manifest.schema.json","sha256":"sha256:105ced7165a1524d353ce1b86ecdc10bdc585a888e322d076a180e73af93ad24"},{"path":"planner_toy/schemas/toy_quality_evaluation_result.schema.json","sha256":"sha256:52ade9cb1a3a8fc321499905144c0b279c724c04a6c6dcb39d56550d5b85f3dd"},{"path":"planner_toy/schemas/toy_quality_optimizer_evidence.schema.json","sha256":"sha256:ff2bfcc2415b776303c57329d336f6d53404bfbdac206d9f58f651b877e0310d"},{"path":"planner_toy/schemas/toy_quality_paired_comparison.schema.json","sha256":"sha256:53d8ae606ee991a26716a9fa4bda500c5565c47729b4dc4c3fe8e7e320cee8ee"},{"path":"planner_toy/schemas/toy_quality_per_seed_summary.schema.json","sha256":"sha256:abed386f480e32b13bb693ff8b763e7f0b76719a50d8e9a70adb8902b273b8eb"},{"path":"planner_toy/schemas/toy_quality_planner_request.schema.json","sha256":"sha256:a5fdc5a89b6ad1a04c1f5de6a47aa808ab27170b860bcacceb302a08851429e6"},{"path":"planner_toy/schemas/toy_quality_semantic_trace.schema.json","sha256":"sha256:85e5c755ca63090dddbdf56b009f5f7325e83a9fd4071cfde6cb772f1f962daa"},{"path":"planner_toy/schemas/toy_quality_structural_breakdown.schema.json","sha256":"sha256:a963179522234c39d29665724597ef2559932be12dd5bb27bdad45ce05c58450"},{"path":"planner_toy/schemas/toy_quality_task_result.schema.json","sha256":"sha256:f2ae58278eabc4172d51f8530a676e1c22177370a9c29b1d94aa8f63c28042fd"},{"path":"planner_toy/schemas/toy_quality_training_config.schema.json","sha256":"sha256:516d1c7c54dd60abe8b4d992650fa0bf896319404e2d25640ceb24f6b0270221"},{"path":"planner_toy/schemas/toy_quality_training_report.schema.json","sha256":"sha256:4a2a06c24d9019fe19456bceca7934479d156a449988ebfd832a83aac44655cd"},{"path":"planner_toy/schemas/toy_quality_work_plan.schema.json","sha256":"sha256:22015b60d4e022a2de0707f90d5b37e097b08e74f9f4d0abf16caba7c817f5b5"},{"path":"planner_toy/schemas/toy_run_result.schema.json","sha256":"sha256:3805ad3a1b1adbfeeb5055b620a8eef5e9620a47b0094c80a5bdf032157f7833"},{"path":"planner_toy/schemas/toy_semantic_trace.schema.json","sha256":"sha256:cbadf6ff106d20ecc95b76784cb7985d282a4549ed423c5ccef152d840a07c2e"},{"path":"planner_toy/schemas/toy_training_report.schema.json","sha256":"sha256:467706cc0d64b6afcdde07fcbb50883ba885a0997d571ba72b7af00777f655a3"},{"path":"planner_toy/schemas/toy_work_plan.schema.json","sha256":"sha256:4ae7924740496a5d387af8a4fde16a69e5df5d897b1418327f8892b5aa661093"},{"path":"planner_toy/semantic.py","sha256":"sha256:cb3bf0dfa030dd436e3942f8ca5e3d83f65b965117cea387fd79d2b98d1d32d7"},{"path":"planner_toy/training.py","sha256":"sha256:4713ed373b085464d4201feceb76c6e1ad63ef8c9913f582b84e69347391a20c"},{"path":"scripts/run_toy_quality_evaluation.py","sha256":"sha256:eec6cdb13f3326ddac75facb164298b126ef4774e71aa8d3856239fefbebe667"}],"evaluator_source_sha256":"sha256:9205ad312fc37fa9927505e9c44a599e29fc5e31180db9d2e49ebfcc247b4570","evaluator_version":"development-quality-evaluation/0.1","heldout_task_count":2,"implementation_commit":"779172c3bbca3d03552deaed6421e82fcf19a932","observed_failure_codes":["GOAL_NOT_ACHIEVED"],"observed_feedback_application_positions":0,"observed_nonzero_downstream_semantic_component_positions":0,"observed_nonzero_feedback_application_positions":0,"paired_comparisons":[{"both_fail":6,"both_succeed":0,"first":"A3","only_first_succeeds":0,"only_second_succeeds":0,"pair_count":6,"second":"A2"},{"both_fail":6,"both_succeed":0,"first":"A4","only_first_succeeds":0,"only_second_succeeds":0,"pair_count":6,"second":"A2"},{"both_fail":6,"both_succeed":0,"first":"A3","only_first_succeeds":0,"only_second_succeeds":0,"pair_count":6,"second":"A4"}],"per_seed":{"A2/seed-17":{"action_applicable_rate":null,"action_parse_valid_rate":1.0,"applicable_action_count":0,"attempted_action_count":0,"end_only_rate":1.0,"end_rate":1.0,"evaluation_unit_count":2,"exact_plan_match_rate":0.0,"execution_completed_rate":1.0,"failure_code_distribution":{"GOAL_NOT_ACHIEVED":2},"fully_executable_plan_rate":0.0,"heldout_task_count":2,"mean_absolute_plan_length_difference":6,"mean_gold_plan_length":6,"mean_predicted_plan_length":0,"median_predicted_plan_length":0.0,"nonempty_plan_rate":0.0,"plan_generation_success_rate":1.0,"seed_count":1,"success_count":0,"task_success_rate